[
  {
    "id": "P0-BUILD-001",
    "tier": "P0-BUILD",
    "severity": "major",
    "category": "unreproducible-release-version",
    "title_zh": "论文给出的唯一安装 tag 不存在，版本标识四处冲突",
    "summary_zh": "安装命令要求 `v1.0.1`，但公开 Git 仓库没有该 branch/tag；提交 `feeccfb` 实际标为 `v0.1.1`，`pyproject.toml` 为 `0.1.1`，包内 `__version__` 仍为 `0.1.0`，而 Zenodo metadata 又写 `v1.0.1`。读者照论文复制命令会立即失败。",
    "locations": [
      {
        "file": "main.tex",
        "line": 229,
        "excerpt": "git clone --branch v1.0.1 https://github.com/AadarshSingh0/HEPLocalAgent.git",
        "role": "primary"
      },
      {
        "file": "main.tex",
        "line": 50,
        "excerpt": "\\newcommand{\\agentversion}{\\texttt{1.0.1}}",
        "role": "duplicate"
      },
      {
        "file": "main.tex",
        "line": 431,
        "excerpt": "The release described in this work is v1.0.1 (commit \\texttt{feeccfb})",
        "role": "duplicate"
      }
    ],
    "evidence": {
      "collector": "agent-read",
      "recompute": "git clone --depth 1 --branch v1.0.1 ... -> fatal: Remote branch v1.0.1 not found; git ls-remote shows feeccfb10... at refs/tags/v0.1.1; pyproject.toml=0.1.1; src/hep_agent/__init__.py=0.1.0; Zenodo 21934091 metadata.version=v1.0.1 and related Git URL ends in v0.1.1.",
      "raw": {
        "paper_commit": "feeccfb",
        "public_tag": "v0.1.1",
        "paper_version": "v1.0.1",
        "package_version": "0.1.1",
        "runtime_version": "0.1.0"
      },
      "evidence_dir_used": false
    },
    "verdict": "CONFIRMED",
    "refutation_attempt": "核对了 heads、tags、精确提交、Zenodo metadata 与两个包版本来源；未找到 v1.0.1 ref。提交本身可获取，但论文命令仍不可执行。",
    "reviewer_impact_zh": "软件论文的首要复现入口失效，会直接削弱代码可用性与 artifact credibility。",
    "fix": {
      "kind": "judgment",
      "auto_applied": false,
      "proposed": "Choose one canonical release identity. Either publish a v1.0.1 tag at the archived commit and update both package version sources, or revise every manuscript/Zenodo occurrence to v0.1.1 and change the clone command accordingly.",
      "rationale_zh": "不能替作者决定产品版本语义，但 Git、包、论文与 Zenodo 必须指向同一个不可变 release。",
      "patch_file": ""
    },
    "depends_on": []
  },
  {
    "id": "P1-CLAIM-001",
    "tier": "P1-CLAIM",
    "severity": "minor",
    "category": "causal-language-overreach",
    "title_zh": "两次重复不足以断言差异“反映”Monte Carlo 统计涨落",
    "summary_zh": "两组 cross section 各只有两次重复，0.3% 的一致性与 Monte Carlo 统计涨落相容，但没有给出每次积分误差或更多重复来排除环境、收敛或实现差异。当前因果措辞强于证据。",
    "locations": [
      {
        "file": "sections/agent_evaluation.tex",
        "line": 231,
        "excerpt": "The repeats used independent random seeds, so this spread reflects Monte Carlo statistical variation rather than a difference in the constructed workflow.",
        "role": "primary"
      }
    ],
    "evidence": {
      "collector": "agent-read",
      "recompute": "|844.3-841.7| / ((844.3+841.7)/2) = 0.3084%; |505.7-504.1| / ((505.7+504.1)/2) = 0.3169%. 两个 pair 都约为 0.3%，但每个 process 只有两点。",
      "raw": {
        "drell_yan_pb": [844.3, 841.7],
        "top_pair_pb": [505.7, 504.1]
      },
      "evidence_dir_used": false
    },
    "verdict": "CONFIRMED",
    "refutation_attempt": "检查了附近是否报告 MadGraph integration uncertainties 或更多重复；未找到。独立 seed 支持该解释，但不能独占地证明它。",
    "reviewer_impact_zh": "方法学审稿人会要求把因果断言降为与统计涨落相容。",
    "fix": {
      "kind": "judgment",
      "auto_applied": false,
      "proposed": "The repeats used independent random seeds, and the observed 0.3% differences are consistent with Monte Carlo statistical variation; with two repeats per process, this check is not designed to isolate all sources of runtime variation.",
      "rationale_zh": "保留观察结果，同时把未被实验排除的替代解释说清楚。",
      "patch_file": ""
    },
    "depends_on": []
  },
  {
    "id": "P2-RIGOR-001",
    "tier": "P2-RIGOR",
    "severity": "major",
    "category": "known-obsolete-scorer",
    "title_zh": "核心结果仍由已知有误的 v1.2 scorer 产生，尚未用 v1.2.1 重算",
    "summary_zh": "作者明确知道 v1.2.1 修正了四个 request family 中两个 family 的 native scorers，却仍让摘要、正文和结论使用 v1.2 数量。论文推测重算只会改变 unnormalized view，但没有执行重算，因此核心数字仍依赖可消除的 measurement error。",
    "locations": [
      {
        "file": "appendices/evaluation_protocol.tex",
        "line": 141,
        "excerpt": "All workflow-construction counts reported in this paper are therefore v1.2 quantities.",
        "role": "primary"
      },
      {
        "file": "appendices/evaluation_protocol.tex",
        "line": 146,
        "excerpt": "The companion benchmark paper subsequently corrected two native scorers in v1.2.1",
        "role": "contradicts"
      },
      {
        "file": "main.tex",
        "line": 437,
        "excerpt": "have not been rescored under the corrected v1.2.1 scorers",
        "role": "duplicate"
      }
    ],
    "evidence": {
      "collector": "agent-read",
      "recompute": "2 of 4 evaluated workflow families use corrected scorers. The paper itself predicts v1.2.1 will raise unnormalized counts and narrow the 7/47 -> 19/47 gap; the exact corrected counts are missing.",
      "raw": {
        "scorer_used": "v1.2@509205c",
        "corrected_release": "v1.2.1",
        "affected_families": 2,
        "total_families": 4
      },
      "evidence_dir_used": false
    },
    "verdict": "CONFIRMED",
    "refutation_attempt": "检查了 normalized operations 是否已经等价覆盖全部修正。作者仅论证 normalized counts 不变；没有提供实际 v1.2.1 rescore 或 corrected unmodified counts。",
    "reviewer_impact_zh": "审稿人很难接受已知 scorer bug 可以修但核心实验仍不重跑。",
    "fix": {
      "kind": "requires-experiment",
      "auto_applied": false,
      "proposed": "Rescore every archived artifact with v1.2.1, regenerate the abstract, Figure 3, Tables 6/9, conclusion, and all prose counts, and retain v1.2 only as a clearly labeled sensitivity analysis.",
      "rationale_zh": "这是离线 scorer 重算，不需要重新调用模型，成本相对低且能消除核心 measurement ambiguity。",
      "patch_file": ""
    },
    "depends_on": []
  },
  {
    "id": "P2-RIGOR-002",
    "tier": "P2-RIGOR",
    "severity": "major",
    "category": "conditional-denominator",
    "title_zh": "91.5% 是“收到可用响应之后”的条件正确率，不是本地系统端到端可靠率",
    "summary_zh": "60 个计划 B--C cases 中只有 47 个得到 usable response；13 个 Llama cases 全因 300 秒 timeout 被排除。论文透明披露了排除，但摘要的 43/47 很容易被读成完整本地系统可靠率，尤其标题强调 on your own computer。应并列报告 availability、conditional correctness 与 planned-case success。",
    "locations": [
      {
        "file": "sections/agent_evaluation.tex",
        "line": 61,
        "excerpt": "The paired B--C study planned 60 model--request cases and obtained usable responses for 47 of them.",
        "role": "primary"
      },
      {
        "file": "sections/agent_evaluation.tex",
        "line": 72,
        "excerpt": "On the 47 semantic units ... 43 (91.5%)",
        "role": "supports"
      },
      {
        "file": "main.tex",
        "line": 74,
        "excerpt": "In a same-response comparison on 47 evaluable model--request cases",
        "role": "duplicate"
      }
    ],
    "evidence": {
      "collector": "agent-read",
      "recompute": "availability = 47/60 = 78.3%; normalized full-pipeline conditional correctness = 43/47 = 91.5%; planned-case success upper-bound when infrastructure-unavailable counts as failure = 43/60 = 71.7%. Unmodified corresponding values: 19/47 = 40.4% conditional and 19/60 = 31.7% planned-case.",
      "raw": {
        "planned": 60,
        "usable": 47,
        "infrastructure_unavailable": 13,
        "normalized_full_pass": 43,
        "unmodified_full_pass": 19
      },
      "evidence_dir_used": false
    },
    "verdict": "CONFIRMED",
    "refutation_attempt": "核对了作者是否把 13 个 timeout 错算为 model semantic failures；作者没有这样做且解释充分。finding 因而不是说 43/47 算错，而是三种 estimand 未在 headline 处并列。",
    "reviewer_impact_zh": "系统/软件审稿人会区分 conditional semantic quality 和 user-observed end-to-end availability。",
    "fix": {
      "kind": "judgment",
      "auto_applied": false,
      "proposed": "Report three quantities together: response availability (47/60, 78.3%), workflow correctness conditional on a usable response (43/47, 91.5%), and planned-case success under the tested serving setup (43/60, 71.7%). Keep clear that the last quantity conflates serving and semantic failures.",
      "rationale_zh": "不否定 paired semantic comparison，但避免把条件正确率当成真实部署可靠率。",
      "patch_file": ""
    },
    "depends_on": ["P2-RIGOR-001"]
  },
  {
    "id": "P2-RIGOR-003",
    "tier": "P2-RIGOR",
    "severity": "major",
    "category": "clustered-effective-sample",
    "title_zh": "47 个 unit 来自仅四个底层 workflow family，headline 未显示 cluster 级稳健性",
    "summary_zh": "20 个 valid requests 是四个 workflow family 各五个 paraphrases，再与模型组合。把 model--request unit 直接汇总会让同一 physics task 的近相关 paraphrases 看起来像独立覆盖。论文承认固定测试集不能外推，但缺少按 family/model 的分层表，无法判断 32 个 fail-to-pass 是否集中于一两个 family。",
    "locations": [
      {
        "file": "sections/agent_evaluation.tex",
        "line": 14,
        "excerpt": "The evaluation uses 20 valid requests from four workflow families ... Each family is represented by five paraphrases",
        "role": "primary"
      },
      {
        "file": "sections/agent_evaluation.tex",
        "line": 75,
        "excerpt": "the paired transitions are 32 fail-to-pass, 11 pass-to-pass, 4 fail-to-fail, and no pass-to-fail",
        "role": "supports"
      }
    ],
    "evidence": {
      "collector": "agent-read",
      "recompute": "nominal semantic units = 47; underlying valid workflow families = 4; paraphrases per family = 5; model-level N = 20, 20, 7. Aggregate transitions do not reveal family concentration.",
      "raw": {
        "nominal_units": 47,
        "workflow_families": 4,
        "paraphrases_per_family": 5,
        "model_denominators": [20, 20, 7]
      },
      "evidence_dir_used": false
    },
    "verdict": "CONFIRMED",
    "refutation_attempt": "查找了 per-family transition table、cluster bootstrap 或 leave-one-family-out sensitivity；正文、附录与图中均未提供。作者的 threats-to-validity 降低了过度外推，但没有补上稳健性证据。",